{
  "dataset_class": "PUBLIC_KB",
  "synthetic": false,
  "version_evidence_id": "evidence:boss-plus-overdraft:a6a77be95d235612a1d562312683e7fe",
  "observation_id": "obs:boss-plus-overdraft:c66d19b4b4f1573aa7521d9059cc3583",
  "product_terms_version_id": "ptv:boss-plus-overdraft:sha256:eb46f7bfb5f9c1cd63dfdb3f4028c2162c3c754d004fe303bffafd18865c7111",
  "product_key": "boss-plus-overdraft",
  "snapshot_hash": "sha256:fa7560e52dda5788bce3f3eb73e06b2dbf7fbefbd19d96b757c9c6fb513dac73",
  "parser_version": "public-kb-html-v2",
  "fact_evidence": [
    {
      "fact_id": "fact:boss-plus-overdraft:applicant_eligibility_text",
      "locators": [
        {
          "strategy": "LABELED_ADJACENT_TEXT",
          "selector": "p.tit3 + p.p-text",
          "label": "가입대상",
          "evidence_text": "- 아래 요건을 모두 충족하는 개인사업자 고객 · 소매형SOHO 6C등급 이상 고객 · KB국민은행으로 카드가맹점 결제계좌를 이용 중이거나 신청한 고객 · 최근 3개월 간 연속하여 발생한 카드매출이 있는 고객",
          "evidence_hash": "sha256:8111a3f6c00919dfdb3e71e2230a3863e3c0f020e75256d1080961ca33834a01",
          "snapshot_hash": "sha256:fa7560e52dda5788bce3f3eb73e06b2dbf7fbefbd19d96b757c9c6fb513dac73",
          "source_url": "https://zloan.kbstar.com/quics?page=C110940"
        }
      ]
    },
    {
      "fact_id": "fact:boss-plus-overdraft:max_limit_individual_krw",
      "locators": [
        {
          "strategy": "LABELED_ADJACENT_TEXT",
          "selector": "p.tit3 + p.p-text",
          "label": "가입대상",
          "evidence_text": "- 아래 요건을 모두 충족하는 개인사업자 고객 · 소매형SOHO 6C등급 이상 고객 · KB국민은행으로 카드가맹점 결제계좌를 이용 중이거나 신청한 고객 · 최근 3개월 간 연속하여 발생한 카드매출이 있는 고객",
          "evidence_hash": "sha256:8111a3f6c00919dfdb3e71e2230a3863e3c0f020e75256d1080961ca33834a01",
          "snapshot_hash": "sha256:fa7560e52dda5788bce3f3eb73e06b2dbf7fbefbd19d96b757c9c6fb513dac73",
          "source_url": "https://zloan.kbstar.com/quics?page=C110940"
        },
        {
          "strategy": "LABELED_ADJACENT_TEXT",
          "selector": "p.tit3 + p.p-text",
          "label": "대출한도",
          "evidence_text": "- 최대 1억원 범위 내 · 대출한도는 고객 신용등급, 월 평균 카드매출, 업종 등에 따라 다르게 산출됩니다.",
          "evidence_hash": "sha256:f67becbaf285cf9e0e51c8d2ff551af68203dd2462d5cc13cf2aad66d611aed1",
          "snapshot_hash": "sha256:fa7560e52dda5788bce3f3eb73e06b2dbf7fbefbd19d96b757c9c6fb513dac73",
          "source_url": "https://zloan.kbstar.com/quics?page=C110940"
        }
      ]
    },
    {
      "fact_id": "fact:boss-plus-overdraft:product_name",
      "locators": [
        {
          "strategy": "CSS_ATTRIBUTE",
          "selector": "input[name=\"브랜드상품명\"]",
          "label": "상품명",
          "evidence_text": "KB사장님+ 마이너스통장",
          "evidence_hash": "sha256:3411185e5da58045833ac9f2f0efa85c9d13f3259dae324650d78c83592751c8",
          "snapshot_hash": "sha256:fa7560e52dda5788bce3f3eb73e06b2dbf7fbefbd19d96b757c9c6fb513dac73",
          "source_url": "https://zloan.kbstar.com/quics?page=C110940"
        }
      ]
    },
    {
      "fact_id": "fact:boss-plus-overdraft:repayment_method_text",
      "locators": [
        {
          "strategy": "LABELED_ADJACENT_TEXT",
          "selector": "p.tit3 + p.p-text",
          "label": "대출기간과 상환방법",
          "evidence_text": "- 대출기간 : 1년 이내 (기한연장 시 최대 5년까지 연장 가능) - 상환방법 : 만기일시상환 (대출기간 중에는 매월 이자만 납부하고, 만기에 전액 상환하는 방법)",
          "evidence_hash": "sha256:506db8801acb9a1c1ca83d1237c9f478d0a897f290d7fb5dff8cfbdf66f5a6d8",
          "snapshot_hash": "sha256:fa7560e52dda5788bce3f3eb73e06b2dbf7fbefbd19d96b757c9c6fb513dac73",
          "source_url": "https://zloan.kbstar.com/quics?page=C110940"
        }
      ]
    },
    {
      "fact_id": "fact:boss-plus-overdraft:sale_status",
      "locators": [
        {
          "strategy": "LABELED_ADJACENT_TEXT",
          "selector": "p.tit3 + p.p-text",
          "label": "상품판매여부",
          "evidence_text": "- 판매 중",
          "evidence_hash": "sha256:400cfb7c01c9ad69e0cce5ead920c783e20d9230892b753ee2869f899f805c12",
          "snapshot_hash": "sha256:fa7560e52dda5788bce3f3eb73e06b2dbf7fbefbd19d96b757c9c6fb513dac73",
          "source_url": "https://zloan.kbstar.com/quics?page=C110940"
        }
      ]
    }
  ]
}
