{
  "dataset_class": "PUBLIC_KB",
  "synthetic": false,
  "version_evidence_id": "evidence:kb-seller-loan:02a5d4f2929b5d1493ad766513d539a2",
  "observation_id": "obs:kb-seller-loan:bfb9f700adf85398bf41bb7c87e758bb",
  "product_terms_version_id": "ptv:kb-seller-loan:sha256:647d5d3588b9d16dce6e4bd91044018a5ab0287c174ac7a945b85bc14abd031d",
  "product_key": "kb-seller-loan",
  "snapshot_hash": "sha256:def6b5b670fc0adf36909ffd1ce47bd416a67e213f7127b5058c44681fe7e44b",
  "parser_version": "public-kb-html-v2",
  "fact_evidence": [
    {
      "fact_id": "fact:kb-seller-loan:applicant_eligibility_text",
      "locators": [
        {
          "strategy": "LABELED_ADJACENT_TEXT",
          "selector": "p.tit3 + p.p-text",
          "label": "대출대상",
          "evidence_text": "- 마켓(또는 PG) : 아래 각 1의 요건을 모두 충족하는 사업자 ㅇ 오프라인 또는 온라인 상에 거래공간, 서비스 등을 제공하는 플랫폼 사업자(오픈마켓, 소셜커머스, 종합몰 등) ㅇ KB와 전문 송수신 프로세스(API, 전용선 등) 구축하여 상품운영에 필요한 셀러별 매출액(배송완료), 반품률 등 정보제공이 가능한 사업자 - 셀러 : 아래 각 1의 기준을 모두 충족하는 고객 ㅇ 당행과 대출한도 제휴되어 있는 마켓(또는 PG)에서 재화 등을 판매하고 있는 셀러 ※ 제휴마켓 : 쿠팡, 지마켓(옥션/G마켓), 무신사, 더블유컨셉코리아, SSG닷컴, KG이니시스 (2026.04.07 기준) ㅇ 당행 심사기준(마켓 또는 PG별 운영기준 별도 운영)을 충족하는 셀러",
          "evidence_hash": "sha256:a1c568f0b557aef50891c1b21a344040c3ed5f7ee31f074424b05b4a96bd4eb9",
          "snapshot_hash": "sha256:def6b5b670fc0adf36909ffd1ce47bd416a67e213f7127b5058c44681fe7e44b",
          "source_url": "https://zloan.kbstar.com/quics?page=C108424"
        }
      ]
    },
    {
      "fact_id": "fact:kb-seller-loan:max_limit_corporate_krw",
      "locators": [
        {
          "strategy": "LABELED_ADJACENT_TEXT",
          "selector": "p.tit3 + p.p-text",
          "label": "대출한도",
          "evidence_text": "- 마켓(또는 PG) : 운전자금한도산정금액 범위 내에서 상환능력, 자금용도 등을 감안하여 결정 - 셀러 (1) 한도약정 : “셀러별 최대 약정한도\"내에서 \"셀러의 마켓별 최대약정한도\"운영 (가) 셀러의 마켓별 최대 약정한도 ㅇ 개인사업자: Min(최근 1년 마켓으로부터 수령한 정산금, 5억원) ㅇ 법인사업자: Min(최근 1년 마켓으로부터 수령한 정산금, 20억원) (나) 셀러별 최대약정한도 ㅇ 개인사업자: 5억원 ㅇ 법인사업자: 20억원 (2) 건별대출 : 약정한도 범위 내에서 정산예정일별 정산예정금액의 70% ~ 95% 범위 내(마켓별 상이)",
          "evidence_hash": "sha256:42823fe7111632b7768bc3ebe9f6d4f358af357ffc02be4b9dec7ce6e126b7eb",
          "snapshot_hash": "sha256:def6b5b670fc0adf36909ffd1ce47bd416a67e213f7127b5058c44681fe7e44b",
          "source_url": "https://zloan.kbstar.com/quics?page=C108424"
        }
      ]
    },
    {
      "fact_id": "fact:kb-seller-loan:max_limit_individual_krw",
      "locators": [
        {
          "strategy": "LABELED_ADJACENT_TEXT",
          "selector": "p.tit3 + p.p-text",
          "label": "대출한도",
          "evidence_text": "- 마켓(또는 PG) : 운전자금한도산정금액 범위 내에서 상환능력, 자금용도 등을 감안하여 결정 - 셀러 (1) 한도약정 : “셀러별 최대 약정한도\"내에서 \"셀러의 마켓별 최대약정한도\"운영 (가) 셀러의 마켓별 최대 약정한도 ㅇ 개인사업자: Min(최근 1년 마켓으로부터 수령한 정산금, 5억원) ㅇ 법인사업자: Min(최근 1년 마켓으로부터 수령한 정산금, 20억원) (나) 셀러별 최대약정한도 ㅇ 개인사업자: 5억원 ㅇ 법인사업자: 20억원 (2) 건별대출 : 약정한도 범위 내에서 정산예정일별 정산예정금액의 70% ~ 95% 범위 내(마켓별 상이)",
          "evidence_hash": "sha256:42823fe7111632b7768bc3ebe9f6d4f358af357ffc02be4b9dec7ce6e126b7eb",
          "snapshot_hash": "sha256:def6b5b670fc0adf36909ffd1ce47bd416a67e213f7127b5058c44681fe7e44b",
          "source_url": "https://zloan.kbstar.com/quics?page=C108424"
        }
      ]
    },
    {
      "fact_id": "fact:kb-seller-loan:product_name",
      "locators": [
        {
          "strategy": "CSS_ATTRIBUTE",
          "selector": "input[name=\"상세웹상품명\"]",
          "label": "상품명",
          "evidence_text": "KB셀러론",
          "evidence_hash": "sha256:7df5a497775595eb188347edceaf43905e7d62abc08f464d072e998f6690313c",
          "snapshot_hash": "sha256:def6b5b670fc0adf36909ffd1ce47bd416a67e213f7127b5058c44681fe7e44b",
          "source_url": "https://zloan.kbstar.com/quics?page=C108424"
        }
      ]
    },
    {
      "fact_id": "fact:kb-seller-loan:repayment_method_text",
      "locators": [
        {
          "strategy": "LABELED_ADJACENT_TEXT",
          "selector": "p.tit3 + p.p-text",
          "label": "원리금상환 방법",
          "evidence_text": "- 일시상환방식 * 이자선취방식 : 원금은 기일에 회수하고, 이자는 일괄선취",
          "evidence_hash": "sha256:c03bbdc9b66dbf8b9b7149e842fa1ed9f5858a75f9fdfd6c13b5fe0435d1f2f6",
          "snapshot_hash": "sha256:def6b5b670fc0adf36909ffd1ce47bd416a67e213f7127b5058c44681fe7e44b",
          "source_url": "https://zloan.kbstar.com/quics?page=C108424"
        }
      ]
    },
    {
      "fact_id": "fact:kb-seller-loan:sale_status",
      "locators": [
        {
          "strategy": "LABELED_ADJACENT_TEXT",
          "selector": "p.tit3 + p.p-text",
          "label": "판매종료 여부",
          "evidence_text": "- 판매중",
          "evidence_hash": "sha256:02db5ddc82a5eb58092f2e658f3e1e08a277077008a9262e0d6f4514b642ae38",
          "snapshot_hash": "sha256:def6b5b670fc0adf36909ffd1ce47bd416a67e213f7127b5058c44681fe7e44b",
          "source_url": "https://zloan.kbstar.com/quics?page=C108424"
        }
      ]
    }
  ]
}
